{
  "schema_version": 1,
  "revision": 1,
  "updated_at": "2026-10-15",
  "repository": "https://github.com/Nakashireyumi/neuro-desktop",
  "branch": "catalog",
  "items": [
    {
      "id": "neuratro",
      "name": "Neuratro",
      "kind": "game-integration",
      "description": "Connect Balatro game state and high-level actions through a Lua mod and Rust bridge.",
      "repository": "https://github.com/VX1D/neuro-sdk-neuratro",
      "source_ref": "main",
      "source_commit": "12a558e5f9ad5e49ab6442a5fbc519b088620d4a",
      "license": {
        "spdx": "LicenseRef-Neuratro",
        "status": "custom",
        "notes": "MIT-derived text includes an additional condition restricting modification. GitHub reports NOASSERTION.",
        "url": "https://github.com/VX1D/neuro-sdk-neuratro/blob/12a558e5f9ad5e49ab6442a5fbc519b088620d4a/LICENSE"
      },
      "platforms": {
        "documented": [
          "windows"
        ],
        "tested": [],
        "notes": "Upstream setup documents Windows paths, version.dll, and a PowerShell launcher. Other operating systems are not verified."
      },
      "game_ids": [
        "balatro"
      ],
      "neuro_api": {
        "transport": "websocket",
        "configuration": "Use the upstream connection setting; preserve the stable game display name. No Neuro Desktop-specific protocol changes are required."
      },
      "install": {
        "mode": "manual",
        "readiness": "license-review",
        "instructions_url": "https://github.com/VX1D/neuro-sdk-neuratro/blob/12a558e5f9ad5e49ab6442a5fbc519b088620d4a/README.md",
        "requirements": [
          "Balatro (Steam)",
          "Lovely injector 0.9.0",
          "Steamodded",
          "Rust toolchain for the bridge"
        ],
        "notes": [
          "Install the Lua mod into the Balatro Mods directory and build the Rust bridge separately.",
          "The README MIT badge does not describe the additional modification condition in LICENSE. Review the actual license before distributing modified code."
        ]
      },
      "permissions": {
        "review_status": "inferred-from-source",
        "enforcement": "upstream",
        "capabilities": [
          {
            "id": "game.state",
            "reason": "Read Balatro state from the mod."
          },
          {
            "id": "game.actions",
            "reason": "Choose game actions exposed by the mod."
          },
          {
            "id": "filesystem.game",
            "reason": "Read and write the game mod and file-based IPC directories."
          },
          {
            "id": "process.start",
            "reason": "Start the local Rust bridge."
          },
          {
            "id": "network.local",
            "reason": "Connect the bridge to your configured Neuro WebSocket endpoint."
          }
        ]
      },
      "settings": [
        {
          "key": "neuro_websocket_url",
          "upstream_key": "NEURO_SDK_WS_URL",
          "type": "string",
          "description": "WebSocket URL for the Neuro API or your compatible relay."
        },
        {
          "key": "ipc_directory",
          "upstream_key": "NEURO_IPC_DIR",
          "type": "string",
          "description": "Directory shared by the bridge and Balatro mod."
        }
      ],
      "verification": {
        "reviewed_at": "2026-10-15",
        "source_links": [
          "https://github.com/VX1D/neuro-sdk-neuratro/blob/12a558e5f9ad5e49ab6442a5fbc519b088620d4a/README.md",
          "https://github.com/VX1D/neuro-sdk-neuratro/blob/12a558e5f9ad5e49ab6442a5fbc519b088620d4a/LICENSE"
        ],
        "unverified": [
          "Game or application runtime not executed by Neuro Desktop maintainers.",
          "No managed install/uninstall recipe or per-platform end-to-end certification."
        ]
      }
    },
    {
      "id": "neurocompanion",
      "name": "Neuro Companion",
      "kind": "game-integration",
      "description": "Add a controllable companion to Terraria through tModLoader, with optional Neuro API actions.",
      "repository": "https://github.com/Pekotaker/NeuroCompanion",
      "source_ref": "master",
      "source_commit": "645181e7ff9b92ee0066537b5a05a214e0d42649",
      "license": {
        "spdx": "NOASSERTION",
        "status": "missing",
        "notes": "No license detected by the GitHub repository API or root README.",
        "url": "https://github.com/Pekotaker/NeuroCompanion"
      },
      "platforms": {
        "documented": [],
        "tested": [],
        "notes": "The project requires Terraria and tModLoader; its README does not verify an OS matrix."
      },
      "game_ids": [
        "terraria"
      ],
      "neuro_api": {
        "transport": "websocket",
        "configuration": "Use the upstream connection setting; preserve the stable game display name. No Neuro Desktop-specific protocol changes are required."
      },
      "install": {
        "mode": "manual",
        "readiness": "license-review",
        "instructions_url": "https://github.com/Pekotaker/NeuroCompanion/blob/645181e7ff9b92ee0066537b5a05a214e0d42649/README.md",
        "requirements": [
          "Terraria",
          "tModLoader",
          "Neuro Companion mod"
        ],
        "notes": [
          "Enable the mod in tModLoader, enter a world, summon the companion, and configure the WebSocket endpoint.",
          "The mod can work without a Neuro API connection.",
          "No repository license was detected at review; this index links to the project and does not redistribute its code or assets."
        ]
      },
      "permissions": {
        "review_status": "inferred-from-source",
        "enforcement": "upstream",
        "capabilities": [
          {
            "id": "game.state",
            "reason": "Read player, companion and nearby game state."
          },
          {
            "id": "game.actions",
            "reason": "Control the companion and transfer allowed inventory items."
          },
          {
            "id": "network.local",
            "reason": "Connect to your configured Neuro WebSocket endpoint."
          }
        ]
      },
      "settings": [
        {
          "key": "neuro_websocket_url",
          "upstream_key": "tModLoader mod config: Randy websocket URL",
          "type": "string",
          "description": "WebSocket URL configured in the mod menu."
        },
        {
          "key": "auto_connect",
          "upstream_key": "tModLoader mod config: Auto-connect on world load",
          "type": "boolean",
          "description": "Connect when a world loads."
        }
      ],
      "verification": {
        "reviewed_at": "2026-10-15",
        "source_links": [
          "https://github.com/Pekotaker/NeuroCompanion/blob/645181e7ff9b92ee0066537b5a05a214e0d42649/README.md",
          "https://github.com/Pekotaker/NeuroCompanion"
        ],
        "unverified": [
          "Game or application runtime not executed by Neuro Desktop maintainers.",
          "No managed install/uninstall recipe or per-platform end-to-end certification."
        ]
      }
    },
    {
      "id": "dont-starve-neuro",
      "name": "Don't Starve Neuro",
      "kind": "game-integration",
      "description": "Connect Don't Starve single-player game state and actions through its mod and Node.js bridge.",
      "repository": "https://github.com/EthLeigh/dont-starve-neuro",
      "source_ref": "single",
      "source_commit": "500892a001a57d3bef017b0075ec80ac8ec2501c",
      "license": {
        "spdx": "MIT",
        "status": "standard",
        "notes": "Repository metadata identifies MIT; dependencies and game assets keep their own licenses.",
        "url": "https://github.com/EthLeigh/dont-starve-neuro/blob/500892a001a57d3bef017b0075ec80ac8ec2501c/LICENSE"
      },
      "platforms": {
        "documented": [],
        "tested": [],
        "notes": "The single branch documents game mod and Node.js setup without an OS support matrix."
      },
      "game_ids": [
        "dont-starve"
      ],
      "neuro_api": {
        "transport": "websocket",
        "configuration": "Use the upstream connection setting; preserve the stable game display name. No Neuro Desktop-specific protocol changes are required."
      },
      "install": {
        "mode": "manual",
        "readiness": "upstream-setup-required",
        "instructions_url": "https://github.com/EthLeigh/dont-starve-neuro/blob/500892a001a57d3bef017b0075ec80ac8ec2501c/README.md",
        "requirements": [
          "Don't Starve single-player (base DS world)",
          "Node.js and npm",
          "Game mod and its API bridge"
        ],
        "notes": [
          "Use the single branch and single-* releases. The default main branch is the discontinued co-op implementation.",
          "The bridge and game mod port configuration must agree.",
          "Start your Neuro API endpoint, then the bridge, then the game; the startup message is sent once."
        ]
      },
      "permissions": {
        "review_status": "inferred-from-source",
        "enforcement": "upstream",
        "capabilities": [
          {
            "id": "game.state",
            "reason": "Read single-player game state."
          },
          {
            "id": "game.actions",
            "reason": "Perform actions exposed by the game mod."
          },
          {
            "id": "filesystem.game",
            "reason": "Install mod files in the game mods directory."
          },
          {
            "id": "process.start",
            "reason": "Run the Node.js API bridge."
          },
          {
            "id": "network.local",
            "reason": "Connect the game bridge and configured Neuro WebSocket endpoint."
          }
        ]
      },
      "settings": [
        {
          "key": "bridge_environment",
          "upstream_key": "dont_starve_neuro/bridge/.env",
          "type": "string",